username,post_title,post_body,subreddit_name,timestamp,url
Jaded_Phone5688,"I just closed a $5,400 AI agent deal and I'm still shaking","l need to share this because I keep seeing people say ""AI agents are dead"" or ""you can't land big clients"" - this is complete BS and here's proof.

**The Client**

Criminal defense lawyer in Australia (keeping them anonymous for obvious reasons). They handle all types of criminal cases and were spending a TON of money hiring people to manage incoming leads. Most leads came through WhatsApp, and they were losing potential clients left and right because they couldn't respond fast enough.

**The Solution I Built**

I created an AI agent that lives in WhatsApp as a chatbot and integrates with their Salesforce CRM. Here's what it does:

\- **Transcribes audio messages** from potential clients automatically

\- **Responds intelligently to any query** 24/7 (like an actual human)

\- **Creates geographic heat maps** based on client addresses - shows where most cases are coming from to enable targeted ad campaigns

\- **Filters and stars high-priority cases** directly in their CRM

\- **Sends final invoices via email** automatically

All inputs come through WhatsApp. All outputs go to Salesforce and email. Complete automation.

**Development time: 5 weeks**

**Testing period: 2 weeks**

**How It Went Down**

First call: Pretty casual, just getting to know each other. He asked for a demo video.

Before the second call: I created a Loom video (about 10 minutes) showing exactly how everything worked. Sent it 2-3 minutes before our meeting.

Second call: This is where it got crazy. We watched the demo together for an hour. I walked him through every feature, showed him how it would replace multiple staff members handling leads.

He was BLOWN AWAY.

By the end of the call, he asked if we could start RIGHT NOW. In 2.5 years as an automation engineer, I've never had a client ready to pay on the spot during the second call.

He said ""let me talk to my finance department to get this started quickly. I love your solution.""

**Less than an hour after that call ended, I received the first 50% payment: $2,700 USD.**

I literally just stared at my bank account. This was real.

**The Results**

Project is now complete. The client is thrilled. 

Here's the kicker: **I'm saving him approximately $250,000 USD annually** by solving their lead response problem and preventing clients from going to competitors.

My fee? **$5,400 total.**

Worth every penny for both of us.

I just sent the final invoice for the remaining $2,700 today as we wrapped up the project.

**To Everyone Saying ""AI Agents Are Dead""**

This post is a punch in the face to that narrative. 

RAG agents work. AI automation works. Real businesses have real problems that AI can solve RIGHT NOW.

Stop listening to the doom and gloom. Start building solutions for real problems.

**Note to mods:** This isn't promotional - I'm not selling anything. Just sharing a success story to counter all the negativity I see here about AI agents being ""dead"" or ""overhyped.""

My hands are literally still shaking as I dictate this using AI for obvious reasons. This is the future, and it's already here.

So all the n8n haters or doubters are u still think that ai agent is ded or have no future? ",n8n,2026-02-11T20:02:56,https://www.reddit.com/r/n8n/comments/1r24m4d/i_just_closed_a_5400_ai_agent_deal_and_im_still/
Commercial-Job-9989,What’s the most useful AI agent you’ve actually used?,"Not demos. Not hype. I mean something that really works in the real world.

\- Saves time

\- Automates a boring task

\- Actually helps people or a team

If you’ve seen or used one, drop a quick reply:

\- What it does

\- Where it’s used

\- How well it works

Even small examples count! Curious to see which AI agents are actually making a difference.",AI_Agents,2026-02-16T15:22:18,https://www.reddit.com/r/AI_Agents/comments/1r69hc2/whats_the_most_useful_ai_agent_youve_actually_used/
Aggressive-Bedroom82,Why is everyone lying about AI agents,"I’ve been in the AI agents space for around 2 years now, and I’ve seen all the cringe posts like “my AI agent can do this or that and save your business $$$ per month!”

And don’t even get me started on the lying YouTubers and content creators hyping how AI will “transform your business” when they haven’t actually helped a single business.

If you sell AI agents and you’ve *actually* helped a business, please share your case studies and what you built.   
  
Because I have yet to see a SINGLE REAL CASE STUDY of a useful agent",aiagents,2026-02-24T19:48:11,https://www.reddit.com/r/aiagents/comments/1rdn5hq/why_is_everyone_lying_about_ai_agents/
everestchris,How I make $300-500/day with an AI agent on a Mac Mini,"So I have this Mac Mini on my desk that basically runs a business for me at this point.

There's this free AI agent that's been going viral lately, I set it up and every day it goes out and finds local businesses that don't have a good website. Plumbers, roofers, dentists, that kind of thing. It builds each one a custom site, finds their email, and sends them a message

It even calls them. Like actually picks up the phone and has a conversation. When they're interested it handles the back and forth and closes the deal. I charge at least $500 per site.

Some days it's one sale, some days two or three. I honestly just check in on it throughout the day at this point.

The whole thing took me maybe 20 minutes to set up. The Mac Mini I already had lying around and I pay about $50/mo in software to keep it running. That's it.

No coding, no cold calling, no sitting there manually building sites for people. The agent just does it all on repeat 24/7.

If anyone's curious about the setup happy to answer questions.",passive_income,2026-02-12T04:54:30,https://www.reddit.com/r/passive_income/comments/1r2hytx/how_i_make_300500day_with_an_ai_agent_on_a_mac/
SheepherderOwn2712,My guide on what tools to use to build AI agents in 2026 (if youre a newb),"Everyone starts somewhere. If you are new to building with AI and you're drowning in ""TOP 10 AI AGENT FRAMEWORKS"" posts that all contradict each other (it is a mess). That is what I actually use day to day, and believe is not only the most simple for people just starting out, but also the most scalable, generalisable, and production ready.  
  
I build AI tools and open-source projects for a living, and I've mass-deleted enough failed experiments to know what works and what doesnt!  
  
So here is what I would recommend in 2026 (but give this a month and who knows...):  
  
**1. Hear me out... OpenClaw if you just want a working agent right now**

If you don't want to build from scratch and just want something running today, OpenClaw is the go-to. 60k+ GitHub stars, self-hosted, connects to Telegram/WhatsApp, has memory, scheduling, and a whole tool marketplace. Plug in your API key, connect some services, done, you have an agent that actually does things.

The tool ecosystem is the real draw. You can wire up search, email, databases, payments, whatever. For search specifically, Brave killed their free API tier in February which screwed over a LOT of people who'd built on it. I switched to Valyu, free credits on signup, really high quality results, just works as a drop-in replacement and there is an open claw skill for it. (also has deep research which I use for heavy research tasks)

**Now the honest bit: if you don't know what a CLI is, don't self-host OpenClaw yet.** I'm serious. Microsoft Security literally published a blog post about how to run it safely. There have been exposed instances with RCE vulns, sketchy skills on the marketplace, people reporting their agents going into loops and burning through hundreds of dollars of API credits overnight. It's really not bad software, but the problem with an open-source project this viral is that a lot of people don't read the setup instructions properly and end up, to be honest, doing dumb things.

  
**2. Vercel AI SDK + Next.js if you want to build your own thing**

If you want to build something custom rather than configure something off the shelf, this is the move. The Vercel AI SDK handles 99% of the annoying boilerplate. Their `useChat` hook gives you a working streaming chat interface in maybe 15 lines of code.  
  
The bit that actually matters though: it's provider-agnostic. Write your code once, swap between Claude, OpenAI, Gemini, whatever, without rewriting your app. That's huge when pricing changes every other week.  
  
Pair it with Next.js and you've got streaming, server actions, API routes, auth, frontend in one codebase, deploy to Vercel in like 30 seconds.   
  
I didn't mean for this to be a Vercel shill post but their ecosystem really is the easiest to get things up and running, especially if you're starting out. And it is also, from my experience, the easiest to scale into serious production applications.  


**3. OpenAI / Claude for your models**

Both providers are good. GPT-5-mini for example is super cheap and good enough for most stuff. Claude Opus is incredible at longer context and more careful reasoning.  
  
**Bit of a hack:** Thing most people don't know: OpenAI has a data sharing program where you opt in to let them use your API traffic for training, and in return you get free tokens daily. Like up to 1M tokens/day on the main models. Go to Settings → Organization → Data Controls → Sharing. Obviously don't turn it on if you're handling anything sensitive. But for side projects and experiments? Free tokens are free tokens lol. They've extended the program a few times so check if it's still live.  


**4. MCPs or Skills for tool use**

MCPs (Model Context Protocol), Anthropic introduced these, OpenAI and Google have adopted them now. Basically they're connectors that let your agent talk to external services without you writing custom API wrappers for everything. Closest thing to a standard we've got. But more recently, skills (markdown files explaining how to use a service...) became more popular. In most cases, doesn't matter if you use MCP or a skill, but:

Ones I'd actually start with:

* **Supabase** \- agent reads/writes your database directly. Kinda wild to see it work
* **Valyu** \- allow your agent to search the web, as well as stuff like live financial data
* **Stripe** \- payments from within the agent
* **PostHog** \- analytics queries straight from the agent
* **Context7** \- this one's slept on. Pulls real-time version-specific docs from actual source repos into your prompt. No more Claude confidently writing code against an API that got deprecated 6 months ago
* **Gmail** \- read and send email

The registry at modelcontextprotocol dot io has hundreds now. Six months ago there were like twelve. And vercel has a skills repository as skills (.) md  


**5. Cursor or Claude Code to actually write the code**

You don't have to write everything by hand. Cursor is an AI code editor, Claude Code does similar stuff from the terminal. Tell either one ""use the Vercel AI SDK to build me an agent that does X with these MCPs"" and you'll have something running in an hour. Not joking. Your ability to articulate what you want to see in the world is the only bottleneck now.

**The mental model**

Putting it all together:

* OpenClaw if you want preconfigured and running today
* Vercel AI SDK + Next.js if you want to build custom
* OpenAI or Claude for the brains
* Valyu for search
* MCPs for integrations
* Cursor/Claude Code to build it all

Agents aren't magic. They're code that calls an LLM and uses tools. That's it. Overcomplicating it in your head is the thing that actually slows you down. Start messy, ship something, fix it later.

Thanks for reading and please ask me anything in the comments or challenge me on anything- happy to go deeper on any of this!",AI_Agents,2026-02-24T14:39:56,https://www.reddit.com/r/AI_Agents/comments/1rdf5v7/my_guide_on_what_tools_to_use_to_build_ai_agents/
Thick_Professional14,I applied to 1000 jobs with AI agent in 48 hours,"https://reddit.com/link/1r8pkhf/video/1rrxr0v4pdkg1/player

Hello, yes like the title says, I was tired of applying to jobs and most of the auto-apply services are paid and its a shit show. so I took matter into my own hands. I present [ApplyPilot](https://github.com/Pickle-Pixel/ApplyPilot) fully automated 6 stage pipeline to discover jobs, filter, tailor resume and apply.

within 48 hours I have 7 interviews scheduled and many pending next step. I never expected this to be that good so I am sharing it with everyone.",claude,2026-02-19T06:26:09,https://www.reddit.com/r/claude/comments/1r8pkhf/i_applied_to_1000_jobs_with_ai_agent_in_48_hours/
Useful-Table-2424,How are people actually building AI agents like this (from zero knowledge)?,"Hey hello, keep seeing videos of people showing crazy AI agent setups that automate everything, like content creation, outreach, research, etc and i search just saw one on instagram that honestly looks impressive but also confusing.

My question is simple, how do you actually build something like that if you’re starting from zero?

I don’t have a technical background and i’m not a developer. Most of the time when i try to learn, i end up in funnels where people just want to sell their “method” or course. And it feels weird because… if this stuff is real and useful, why is everyone only selling tutorials instead of just explaining the basics?

I’m not looking for a shortcut or a get rich quick thing lol i just genuinely want to understand, and what tools people are really using or what skills are actually needed or where someone with zero experience should start and how much of this is hype vs real?

If anyone here has built agents or is learning seriously, i'd really appreciate honest guidance. Explain it to me like I know nothing, because i don’t ahahah i’ll drop the video that made me curious in the comments thaaanks",AI_Agents,2026-02-08T17:28:46,https://www.reddit.com/r/AI_Agents/comments/1qzbsy8/how_are_people_actually_building_ai_agents_like/
aiagent_exp,What’s the most useful thing you’ve automated with an AI agent so far?,"Hey everyone I’ve been experimenting with AI agents lately and I’m honestly surprised at how quickly they’re moving from “cool demo” to actually useful tools.

So far I’ve tried using agents to:

- Monitor emails and draft replies
- Summarize long documents and meetings
- Do small research tasks and compile notes
- Automate repetitive workflows (like pulling data + generating reports)

But I feel like I’m barely scratching the surface.

I’m curious:

- What real workflows are you running with AI agents?
- Any setups that actually save you serious time (not just tinkering)?
- Biggest failures or lessons learned?
- Tools / frameworks you’d recommend?

Would love to hear real-world examples especially anything in production or side projects that genuinely made life easier.

Let’s share what’s working (and what isn’t)!",AI_Agents,2026-02-15T16:41:00,https://www.reddit.com/r/AI_Agents/comments/1r5g8xv/whats_the_most_useful_thing_youve_automated_with/
lurker_bee,"Google's Agentic AI wipes user's entire HDD without permission in catastrophic failure — cache wipe turns into mass deletion event as agent apologizes: “I am absolutely devastated to hear this. I cannot express how sorry I am""",,technology,2025-12-04T16:02:24,https://www.tomshardware.com/tech-industry/artificial-intelligence/googles-agentic-ai-wipes-users-entire-hard-drive-without-permission-after-misinterpreting-instructions-to-clear-a-cache-i-am-deeply-deeply-sorry-this-is-a-critical-failure-on-my-part
MarvelsGrantMan136,Amazon blames human employees for an AI coding agent’s mistake / Two minor AWS outages have reportedly occurred as a result of actions by Amazon’s AI tools.,,technology,2026-02-20T18:54:01,https://www.theverge.com/ai-artificial-intelligence/882005/amazon-blames-human-employees-for-an-ai-coding-agents-mistake
MetaKnowing,"AI agents now have their own Reddit-style social network, and it's getting weird fast",,Futurology,2026-01-31T16:25:32,https://arstechnica.com/information-technology/2026/01/ai-agents-now-have-their-own-reddit-style-social-network-and-its-getting-weird-fast/
notyourregularninja,"After laying off 4,000 employees and automating with AI agents, Salesforce executives admit: We were more confident about llms a year ago",,wallstreetbets,2025-12-26T08:05:23,https://timesofindia-indiatimes-com.cdn.ampproject.org/c/s/timesofindia.indiatimes.com/technology/tech-news/after-laying-off-4000-employees-and-automating-with-ai-agents-salesforce-executives-admit-we-were-more-confident-about-/amp_articleshow/126121875.cms
lurker_bee,AI agents wrong ~70% of time: Carnegie Mellon study,,technology,2025-06-30T03:15:27,https://www.theregister.com/2025/06/29/ai_agents_fail_a_lot/
Fcking_Chuck,Microsoft is rolling out AI agents that can access some of your files,,pcmasterrace,2025-11-19T05:12:44,https://www.pcgamer.com/software/windows/apparently-windows-11-becoming-agentic-ai-means-letting-the-bots-rummage-through-some-of-your-files/
etern4lflux,"After laying off 4,000 employees and automating with AI agents, Salesforce executives admit: We were more confident about AI a year ago",,technology,2025-12-23T21:37:50,https://timesofindia.indiatimes.com/technology/tech-news/after-laying-off-4000-employees-and-automating-with-ai-agents-salesforce-executives-admit-we-were-more-confident-about-/amp_articleshow/126121875.cms
ser_davos33,"I just watched an AI agent take a Jira ticket, understand our codebase, and push a PR in minutes and I’m genuinely scared","I’m a professional software engineer, and today something happened that honestly shook me. I watched an AI agent, part of an internally built tool our company is piloting, take in a small Jira ticket. It was the kind of task that would usually take me or a teammate about an hour. Mostly writing a SQL query and making a small change to some backend code.

The AI read through our codebase, figured out the context, wrote the query, updated the code, created a PR with a clear diff and a well-written description, and pushed it for review. All in just a few minutes.

This wasn’t boilerplate. It followed our naming conventions, made logical decisions, and even updated a test. One of our senior engineers reviewed the PR and said it looked solid and accurate. They would have done it the same way.

What really hit me is that this isn’t some future concept. This AI tool is being gradually rolled out across teams in our org as part of a pilot program. And it’s already producing results like this.

I’ve been following AI developments, but watching it do my job in my codebase made everything feel real in a way headlines never could. It was a ticket I would have knocked out before lunch, and now it’s being done faster and with less effort by a machine.

I’m not saying engineers will be out of jobs tomorrow. But if an AI can already handle these kinds of everyday tickets, we’re looking at serious changes in the near future. Maybe not in years, but in months.

Has anyone else experienced something similar? What are you doing to adapt? How are you thinking about the future of our field?",cscareerquestions,2025-07-17T04:42:34,https://www.reddit.com/r/cscareerquestions/comments/1m1uw9v/i_just_watched_an_ai_agent_take_a_jira_ticket/
WhatYouThinkYouSee,"An account with 120k+ followers has been rapidly posting unmarked AI-generated videos of fictional ICE agents being attacked and discriminated, with many of them involving white women driving at them in cars. None of the videos are labeled as fake or AI-generated.",,ThatsInsane,2026-01-10T18:23:24,https://v.redd.it/aq5optkmsjcg1
QualitativAI,Pokemon Wet Market - A fanfic my unhinged AI agent wrote...,,aivideo,2025-12-03T19:09:09,https://v.redd.it/gcat1ef1i05g1
rkhunter_,"Microsoft admits AI agents can hallucinate and fall for attacks, but they’re still coming to Windows 11",,technology,2025-12-01T07:37:16,https://www.windowslatest.com/2025/11/30/microsoft-says-ai-agents-are-risky-but-its-moving-ahead-with-the-plan-on-windows-11/
yojimbo_beta,"Slop pull request is rejected, so slop author instructs slop AI agent to write a slop blog post criticising it as unfair",,programming,2026-02-12T14:35:55,https://github.com/matplotlib/matplotlib/pull/31132
Diedalonglongtimeago,"Melissa Barrera calls out agents trying to sign AI Actress Tilly Norwood: ""Hope all actors repped by the agent that does this, drop their a$$. How gross, read the room""",,Fauxmoi,2025-09-29T05:17:07,https://i.redd.it/45axiltsj0sf1.png
upyoars,"The AI revolution will cut nearly $1 trillion a year out of S&P 500 budgets, largely from agents and robots doing human jobs",,Futurology,2025-08-24T23:34:02,https://fortune.com/2025/08/19/morgan-stanley-920-billion-sp-500-savings-ai-agentic-robots-jobs/
ZacB_,"Microsoft warns that Windows 11's agentic AI could install malware on your PC: ""Only enable this feature if you understand the security implications""",,technology,2025-11-18T13:03:00,https://www.windowscentral.com/microsoft/windows-11/microsoft-warns-security-risks-agentic-os-windows-11-xpia-malware
just_a_person_27,Sam Altman officially confirms that OpenAI has acquired OpenClaw; Peter Steinberger to lead personal agents,"Sam Altman has announced that Peter Steinberger is joining OpenAI to drive the next generation of personal agents.   
As part of the move, OpenClaw will transition to a foundation as an open-source project, with OpenAI continuing to provide support.

https://preview.redd.it/qy3x8g1bfqjg1.png?width=895&format=png&auto=webp&s=2ee50643e7a16f7e09c724cef1c66f5c892cdac7

",OpenAI,2026-02-16T00:09:55,https://www.reddit.com/r/OpenAI/comments/1r5rnbl/sam_altman_officially_confirms_that_openai_has/
Shoe_boooo,"""Multiple talent agents are reportedly in talks to sign AI actress Tilly Norward, created by AI talent studio Xicoia.""",,BrandNewSentence,2025-09-27T21:14:26,https://i.redd.it/6xkmqapr0rrf1.png
WarmAd5143,Any tips to run multi-agents in OpenClaw ?,"Really enjoying OpenClaw so far — it made building a personal agent much easier than I expected.

Right now mine can answer questions and handle basic file operations, which is great. But I feel like I’m not fully using its potential yet.

Has anyone experimented with running multiple agents together? Curious how people structure that kind of setup.",openclaw,2026-03-03T05:29:26,https://www.reddit.com/r/openclaw/comments/1rjeisn/any_tips_to_run_multiagents_in_openclaw/
Difficult_Singer_771,Best way to create AI Team (multi agent systems),Best way to create AI Team (multi agent systems),openclaw,2026-03-07T19:07:08,https://www.reddit.com/r/openclaw/comments/1rnf84r/best_way_to_create_ai_team_multi_agent_systems/
arealguywithajob,Multi agent orchestration,"I'm wondering how people here are handling multi agent orchestration. I really like gh copilot but I feel like the bottleneck is now having multiple agents at once working at parallel and figuring out how to handle that and I feel as though the UI/UX for copilot does not help for this.

Having the sessions tab on the side does not solve the problem for me either I feel like because I want to be able to pin agents and currently that is not a feature.


I also think that having multiple codex / claude code terminals open at once is not the answer either.

I need a single cockpit like interface where I can see my agents see my gh project board and see my actions and my PRs all in one place.

For me the problem is only exacerbated when working in multi repo workspaces, though I feel I have better control of agents since they do not overlap if I keep them to a specific repo.

Does anyone else feel the same way or is it just me?

TLDR I don't like context switching and wish that there was a more cockpit like experience in vs code with the copilot extension...really wish I could pin a chat...
",GithubCopilot,2026-02-27T05:55:08,https://www.reddit.com/r/GithubCopilot/comments/1rfw6y9/multi_agent_orchestration/
