username,post_title,post_body,subreddit_name,timestamp,url
LucyAriaRose,I think my kids school lied about calling CPS rather than calling my husband to pick her up,"**I am NOT the Original Poster. That is** [Less\_Roll4824](https://www.reddit.com/user/Less_Roll4824/)**.** She posted in r/TrueOffMyChest

Thanks to u/BakingGiraffeBakes for the rec!

# Do NOT comment on Original Posts. Latest update is 7 days old.

**Trigger Warning:** >!threatening to call CPS for unfounded reasons; misogyny !<

**Mood Spoiler:** >!good ending!<

**Original** [Post](https://www.reddit.com/r/TrueOffMyChest/comments/1nenudc/i_think_my_kids_school_lied_about_calling_cps/)**: September 11, 2025**

Our daughter (7) started school last month. I told the front office under no circumstance should they call me if something happens to her, especially Wednesday Thursday or Friday. I work, and I am not allowed to have my phone on my person while working. They were told explicitly to call her father, who works overnight but is home all day as a result.

I get to my lunch break today, and what do I find but SIXTEEN missed calls from the school.

I assume she’s been hospitalized or there’s been an active shooter. Something horrible that warrants sixteen calls to the parent they were told not to call.

I call the school frantically before even looking at my voice mail and find that they called me because she threw up.

Threw up.

Blood?

Nope. Regular throw up.

But because I didn’t answer this woman considered it ‘abandonment’ and made a call to CPS.

I asked if they’d called my husband. Nope. Just me! And I didn’t answer, which isn’t allowed.

I called him and he went to pick her up. There was a woman sitting with her in the nurses office who was also there during orientation night, but she wasn’t our kids teacher or administration so we didn’t get introduced to her.

As soon as my husband got there she scurried off, and when he asked the woman at the front desk who she was she reiterated that she had ‘called someone about your wife abandoning your daughter’. And told him if it happened again it would be a lot more serious, and we should consider making sure moms always there when her kid needs her.

There is no fucking way that a CPS agent is just hanging around this school at all times, and didn’t bother to stick around to lecture a parent who ‘abandoned’ their kid when they showed up.

I think they lied because they don’t like that dad is supposed to be their primary point of contact.

I’m going to follow up with the principal when I’ve calmed down of course, but what the actual fuck.

***Some of OOP's Comments:***

Commenter: Is it documented that you are unavailable for those three days, or is dad listed as the primary contact? 

>**OOP:** Both. It was all written down explicitly when we were filling everything out. He’s the primary, and I’m secondary with special instruction.   
Her grandmother is the emergency contact, and also wasn’t called 

Top Commenter: Make sure it’s well documented. They need to follow the communication orders you give them. They don’t get to decide that the mother must answer. I’d threaten a lawsuit if they continue this behavior and make false CPS reports.

>**OOP:** It’s all in writing and has been since we first started filling out the paper work.   
If you mean the woman claiming she called CPS, unfortunately I only had that conversation over the phone call and not a text message 

Commenter: CPS will provide you with a letter to document the investigation, and then another letter to confirm that it was founded or if no evidence was found. You can call CPS and ask them to confirm if you're being investigated. If the school didn't exhaust all means of contact, CPS is waaaay too overburdened to send someone to investigate this. Sounds like bullshit to scare you.

>**OOP:** I’m almost positive it is. There’s no way an actual CPS person wouldn’t have at least spoken to my husband when he showed up, whether they really believed this was abandonment or not 

Commenter: Im willing to bet it was a school counselor or social worker. If they did complain, CPS has 72 hours to follow Up IF SUBSTANTIATED.

>**OOP:** That would make more sense. They definitely work there and aren’t a direct teacher, and the counselors are split up based on student last names, so we met hers but I know there’s at least 5.

*To an idiot commenter saying OOP should have had her phone regardless of the rules (I'm including one comment from OOP because I liked it)*

>**OOP:** No. It is not allowed on my person period. Nothing with a battery is that isn’t distributed by the company itself, and our assigned pagers do not allow outside calls. You can look at your phone on your breaks.   
Lol what do you think people did before cell phones? Do you think kids were just keeling over in the nurses office because the home phone wasn’t picked up and the office was too stupid to try anything else?   
*Later in the comment thread to ""no job is too important not to let you have your phone for your kid""*  
When the battery and the phone signal could disrupt the equipment or cause excess static and cost tens of thousands of dollars in damages it is. Especially when that person has other family members who should be called first. 

**Update** [Post](https://www.reddit.com/r/TrueOffMyChest/comments/1nk3dca/update_i_think_my_kids_school_lied_about_calling/)**: September 18, 2025 (1 week later)**

First off, thanks for everyone for their supportive comments, especially Bajanbeautykatie for the email template. \[Editor's note: link to that [here](https://www.reddit.com/r/TrueOffMyChest/comments/1nenudc/comment/ndqa3p4/?context=3That)\] was very nice, although I did start of by sending something less confrontational.

To answer the most common questions:

The school had documentation to call my husband, or his mother ever since we enrolled there. I double checked our computer portal with the school website and it's still listed that way, including that I can't be contacted for anything that might be time sensitive.

I cannot have my phone on my person while I'm working, period.

My work place has an automatic answering machine for public calls, so even if the school did call them I wouldn't get the message for probably another half hour at absolute best. Even then, I work about 30-40 minutes away if traffic is good.

Yes, I am in a more traditional area, although its never been too huge of a deal before besides having to commute to the city for work.

This is not going to be the super dramatic update I'm sure a lot of people were hoping for. Sorry?

First off, I did not jump straight to getting an attorney to threaten them. I did call and ask a local family law firm and the person I spoke to told me if we did have to go as far as suing it would look better to try to exhaust options on my own before threatening legal action, but they would be happy to look over any communications between us and we could CC them on any emails and asked me to get any information on the potential neglect/abandonment case I could while they looked into it as well.

I started by sending a follow up email to the principal, and CC'd the superintendent and LawPerson on it asking for confirmation that they had checked our file for who to call, more details on who exactly was spoken to at CPS, any case numbers, and the name of the person who was sitting alone with my sick daughter and did not speak to my husband or identify themselves. Unfortunately(or maybe fortunately?) the principal was out of town for several days with some family emergency.

After a day with no reply the superintendent emailed me directly asking for more details, and I sent them an email outlining exactly what had happened from our perspective, screen shots from my phone, my husband's phone, and his mother's phone showing the phone calls and the lack of them.

Monday the principal finally got back to us and we got some answers.

The woman sitting with our daughter was one of the school councilors, just not the one assigned to her.

No one actually contacted CPS, there is no case open against us, that was just a straight up lie. The woman who told me she had, had actually called the schools social worker(not CPS), who then sent the counselor to sit with her. Instead of, you know, telling her that was ridiculous or going himself. The counselor claims she was under the impression that she was just keeping our daughter company until the parents arrived, since there was no nurse that day. But if that was the case she should have at least said hello, right?

And I'm not sure if he was supposed to tell me this, but apparently this is not the first time they've had issues with how she responds to fathers or male care givers in general. Which I want to know, if that’s the case why didn’t anyone do anything about it before? What the fuck?

As of now she's been suspended pending investigation.

Obviously these aren't all of the details, but this is the gist of it.

I'm sure a lot of people were hoping to hear I'd sued the school for defamation, harassment, threatening, whatever else and gotten that stupid woman fired for being a misogynistic bitch.

But, this is what we've got lol.

***Some of OOP's Comments:***

Commenter: It sounds like the woman’s behavior will be doing all the work of getting her reprimanded and/or fired.

>**OOP:** Hopefully fired! 

Commenter: (downvoted but included for OOP's answer) I’m confused because in your first story, you said that the woman sitting with your daughter took off but that it was the front desk person who lectured your husband about you abandoning your child. It sounds to me like both women need to have a level of discipline around the fact that fathers can be first line caregivers.

>**OOP:** No? I said the woman sitting with her was one we didn’t recognize; who was not her teacher or administration but who we’d seen at orientation. Not that she was the one who called us. 

Commenter: If she has a problem with male caregivers, why not just call mother in law?

>**OOP:** My only guess is She has a gender neutral/somewhat masculine name and is listed as ‘grandparent’ in the check box, so maybe they assumed she was a man 🤷‍♀️ 

Commenter: Who got suspended? The counselor lady or the lady at the desk?

>**OOP:** Desk, sorry. Although I kind of feel the councilor should have gotten some of that too for going along with this bullshit. But I’m not privy to every single detail of disciplinary action 

**Editor's note:** Marked as concluded because OOP got answers and found out what happened.",BestofRedditorUpdates,2025-09-25T07:00:38,https://www.reddit.com/r/BestofRedditorUpdates/comments/1npwz83/i_think_my_kids_school_lied_about_calling_cps/
Any_Row1696,AIO my insurance agent emailed me this,"I switched to a different office location of the SAME insurance company recently because it’s closer to home. I had only been with my previous insurance agent at the other branch for the last two or three years, only met him in person once, only contacted him when I had policy questions. 

After a few vague, unhelpful emails when I asked him policy-related questions recently, I decided to switch to a different branch closer to home so I can just stop by the office when I have questions about something instead of emailing someone back and forth. 

Not even 5 minutes after I signed the transfer paperwork, the agent emails me this, see screenshot. It made me uncomfortable to say the least and to me is very unprofessional. 

Also, some context about the comment he made about finding my son a car - When I added my son as a new driver to my policy awhile back, the agent asked me if my son had a car that I needed to add to the policy as well. I made the offhand comment, “not yet but if you happen to see or know someone with a small truck for sale, let me know”. I also made this comment to my neighbors, my friends, family, anyone I could think of, just putting my feelers out trying to find a decent used vehicle for my new driver. I think he sent me one link to a car for sale that I ended up not buying. If I had known he would hold that over my head a year later, I would’ve never mentioned it to him. 

I let my new agent know that I had gotten this email and I didn’t respond to the email, but I just can’t believe someone would take it upon themselves to say something like that to a client. Also it goes without saying that the previous agent has access to all of my personal information which doesn’t make me feel great. I’ve even thought about switching insurance companies after all of this. 

AIO? ",AIO,2026-03-05T17:07:32,https://i.redd.it/ejlmmndds8ng1.jpeg
DrakeInq,Evidence of Booking.com fudging reviews,"My wife and I decided to have an extra long holiday in northern Italy over Christmas after I completed my PhD in October. We booked an apartment in central Milan through Booking.com from the 20th to the 23rd of December. Upon our late arrival in this 10th floor attic apartment called “The Attic Centrale - Netflix” I noticed quite a prominent damp smell but it was dark and we had just been through 5 hours of traveling so we went to bed. Next morning I find black mould pretty much all over the place. In the window sills, on the ceilings, and along the floor skirting. I message the property manager letting them know that this is a serious health and safety issue, especially for us who are travelling with a 4 year old with asthma and me with a compromised immune system due to Crohn’s disease. He appears understanding and claims to be unaware of the problem and says he’s happy to send a cleaning company to sort it out. I let them know that surface cleaning black mould doesn’t address the problem and that it would just expose us to more spores. I ask for a full refund or a suitable replacement. They say: “Hi, Booking.com customer service called me and told me that to get a refund, you have to check out today. This way, I can rent the apartment to another guest and you can get a refund without any problems.”

I reach out to Booking.com customer service with their dumb AI telephone agent and eventually get a hold of a human being. I let them know that this place should not be rented out and that there’s black mould. The line disconnects and they don’t call back. We all headed out to see the city and while we were having lunch I get a call from Booking.com saying almost word for word:

“We would like to inform you that the property has agreed to approve a free cancellation, under specific conditions communicated by them. The property confirmed that the free cancellation can be granted provided that:

You leave the property immediately, and No negative review is published regarding the stay.

Please note that, according to the property, if these conditions are not respected, the refund will not be issued.

Kindly let us know if you agree with these terms so we can proceed accordingly and confirm the next steps with the property.”

I was fuming at this point. Not only because I had to spend the start of this holiday glued to my phone and stressing about the situation, or because anything half decent in the area was double the cost so a full refund would still not put us in a good position, but because I had to fight this property manager and Booking.com who apparently could only apparently issue a refund if approved by the property manager. 

I argued with several of their agents (with two of them hanging up on me). Just like with the first two, I told the third one that I booked through Booking.com and based the decision to stay in this particular apartment on the misleading reviews on Booking.com. 

Now we’re stuck in this mouldy ass apartment with no refund and everything else around us being way too expensive. The last agent I spoke to tells me that after 48 hours of the agent not responding, Booking.com will take over the issue and start their own investigation for a refund they would pay out depending on the decision of the investigation. ",travel,2025-12-21T23:42:34,https://www.reddit.com/gallery/1pshx5w
